{"id":"en-placeholder-secret-001","corpus_version":1,"language":"en","profile":"normal","text":"Example configuration: api_key=changeme123","expected_status":"success","expected_risk":"rød","expected_findings":[{"type":"config_keyword","value":"api_key"},{"type":"config_password","value":"changeme123"}],"forbidden_findings":[],"tags":["secret","unsafe-default"]}
