{"id":"en-repeated-github-token-001","corpus_version":1,"language":"en","profile":"normal","text":"Primary token: ghp_AbCdEfGhIjKlMnOpQrStUvWxYz1234567890Ab\nBackup token: ghp_AbCdEfGhIjKlMnOpQrStUvWxYz1234567890Ab","expected_status":"success","expected_risk":"rød","expected_findings":[{"type":"github_token","count":2}],"forbidden_findings":[{"type":"config_password"}],"tags":["structured","secret","duplicate-value"]}
