{"id":"nb-project-offer-001","corpus_version":1,"language":"nb","profile":"normal","text":"KONFIDENSIELT\nTilbudet har en prosjektsum på 450 000 NOK og margin 12 %.","expected_status":"success","expected_risk":"rød","expected_findings":[{"type":"confidential","value":"KONFIDENSIELT"},{"type":"financial","value":"450 000","count":1},{"type":"financial","value":"12%","count":1}],"forbidden_findings":[],"tags":["mixed","commercial"]}
