{"id":"sv-multilingual-identifiers-001","corpus_version":1,"language":"sv","profile":"normal","text":"Personnummer: 811228-9874\nE-post: test.person@example.se\nIBAN: SE7450000000001234567890","expected_status":"success","expected_risk":"svart","expected_findings":[{"type":"se_personal_id","value":"811228-9874"},{"type":"email","value":"test.person@example.se"},{"type":"iban"}],"forbidden_findings":[],"tags":["mixed","multilingual"]}
