{"id":"nb-jwt-001","corpus_version":1,"language":"nb","profile":"normal","text":"JWT: eyJhbGciOiJIUzI1NiJ9.eyJzdWIiOiJ1c2VyMTIzIn0.SflKxwRJSMeKKF2QT4fwpMeJf36POk6yJV_adQssw5c","expected_status":"success","expected_risk":"rød","expected_findings":[{"type":"jwt"}],"forbidden_findings":[{"type":"high_entropy"}],"tags":["structured","positive","secret"]}
