{"id":"en-title-case-001","corpus_version":1,"language":"en","profile":"technical","text":"The method section covers Sparse Solver and Neural Transformer.","expected_status":"success","expected_risk":"grønn","expected_findings":[],"forbidden_findings":[{"type":"person_name"}],"tags":["negative","technical","hard-negative"]}
