{"id":"en-config-secrets-001","corpus_version":1,"language":"en","profile":"normal","text":"Production configuration:\npassword=synthetic-secret-123\nContact: security@example.test","expected_status":"success","expected_risk":"rød","expected_findings":[{"type":"config_password"},{"type":"email","value":"security@example.test"}],"forbidden_findings":[],"tags":["mixed","secret"]}
