{"id":"en-real-server-ip-001","corpus_version":1,"language":"en","profile":"technical","text":"Version 4.2 runs on server 10.20.30.40.","expected_status":"success","expected_risk":"gul","expected_findings":[{"type":"ip_address","value":"10.20.30.40"}],"forbidden_findings":[],"tags":["mixed","technical","ip"]}
